name,reviews_count,contact,facilities,timing,address,known_for,restaurant_facilities,costing,top_dishes,other
dominos-pizza-wagholi,Average,88,['18602100000'],"['Home Delivery', 'Indoor Seating', 'Free Parking']",11am - 3am (Today),"Shop 2, Gate 559/1, Rainbow Cross Road, Pune Nagar Highway, Wagholi, Pune",Quick Bites,"['Well Sanitized Kitchen', 'Rider Hand Wash', 'Daily Temp. Checks']","['Cash and Cards accepted', 'Home Delivery', 'Indoor Seating', 'Free Parking']",Rs. 400 for two people (approx.)
pizza-hut-kharadi,Good,223,['+912066279695'],"['Home Delivery', 'Indoor Seating']",,"Shop 4, Ground Floor, Unit F & B 04, Tower-2, World Trade Centre, City Hub, Pune Nagar Road, Opposite EON Free Zone, Haveli, Kharadi, Pune",,"['Well Sanitized Kitchen', 'Rider Hand Wash']","['Decor', 'Cash and Cards accepted', 'Home Delivery', 'Indoor Seating']","Pizza, Garlic Bread, Potato Wedges, Tandoori Paneer",Rs. 600 for two people (approx.)
mcdonalds-satara-road,Good,479,"['+918928210242', '+912065272015', '+918087062015']","['Breakfast', 'Home Delivery', 'Indoor Seating']",Opens tomorrow at 7am,"692 A2A, Near City Pride Multiplex, Saluja Chambers, Satara Road, Pune",Quick Bites,"['5 - Excellent', 'Well Sanitized Kitchen', 'Rider Hand Wash']","['Friendly Staff', 'Cash and Cards accepted\nDigital payments accepted', 'Breakfast', 'Home Delivery', 'Indoor Seating']","Burgers, Coffee, Cappuccino, Hot Chocolate, French Fries, Peri Peri Fries, Aloo Tikki",Rs. 500 for two people (approx.)
kfc-1-kharadi,Good,125,"['+919637174418', '+919112685099']","['Home Delivery', 'Mall Parking', 'Indoor Seating', 'Free Parking']",,"Survey 60, Shop 4, Ground Floor, Pradeep Plaza West Wing, Ganga Platino, Kharadi, Pune",,"['Well Sanitized Kitchen', 'Rider Hand Wash']","['Cash and Cards accepted\nDigital payments accepted', 'Home Delivery', 'Mall Parking', 'Indoor Seating', 'Free Parking']",Rs. 450 for two people (approx.)
ovenstory-pizza-1-kharadi,Very Good,46,['+919152987607'],['Delivery Only'],Opens tomorrow at 11am,,Pizza,"['Well Sanitized Kitchen', 'Rider Hand Wash', 'Daily Temp. Checks']","['Cash and Cards accepted', 'Delivery Only']","Chocolate Fantasy, Veggie Pizza, Paneer Pizza",Rs. 600 for two people (approx.)
natural-ice-cream-kondhwa,Good,63,"['+912024263199', '+919561024717']","['Home Delivery', 'Vegetarian Only', 'Outdoor Seating', 'Indoor Seating', 'Desserts and Bakes']",Opens tomorrow at 10am,"5 & 6, Rajmata Apartment, Bibewadi, Kondhwa, Pune",Dessert Parlor,['Rider Hand Wash'],"['Cash and Cards accepted', 'Home Delivery', 'Vegetarian Only', 'Outdoor Seating', 'Indoor Seating', 'Desserts and Bakes']",Rs. 150 for two people (approx.)
burger-king-wagholi,Good,51,['+918552921515'],"['Home Delivery', 'Mall Parking', 'Indoor Seating', 'Free Parking']",10am - 12midnight (Today),"Shop 1, Rainbow Crossroad, Pune Nagar Highway, Bakori Phata, Wagholi, Pune",Quick Bites,"['5 - Excellent', 'Well Sanitized Kitchen', 'Rider Hand Wash']","['Cash and Cards accepted', 'Home Delivery', 'Mall Parking', 'Indoor Seating', 'Free Parking']",Rs. 500 for two people (approx.)
le-plaisir-deccan-gymkhana,Excellent,"4,756","['+918550995835', '+918550995865']","['Breakfast', 'Home Delivery', 'Indoor Seating', 'Desserts and Bakes']",Opens tomorrow at 9am,"Survey 759/125, Rajkamal, Opposite Kelkar Eye Hospital, Prabhat Road, Deccan Gymkhana, Pune",Café,['Well Sanitized Kitchen'],"['Cash and Cards accepted', 'Breakfast', 'Home Delivery', 'Indoor Seating', 'Desserts and Bakes']","Courteous Staff, Friendly Staff, Friendly Service, Decor, Classy Place, Comfortable Seating","Rs. 1,000 for two people (approx.)"
aromas-hyderabad-house-warje,Good,378,"['+917028030777', '+917028050777']","['Home Delivery', 'Indoor Seating']",Opens tomorrow at 12noon,"Survey 116, Showroom 101, Mumbai-Bangalore Highway, Warje, Pune",Casual Dining,"['4 - Very Good', 'Well Sanitized Kitchen']","['Home Delivery', 'Indoor Seating']","Cash, Cards and Meal Coupons accepted",Rs. 900 for two people (approx.)
mojo-pizza-2x-toppings-katraj,Very Good,126,['+912233252828'],['Delivery Only'],11am - 1am (Today),,Pizza,"['Well Sanitized Kitchen', 'Rider Hand Wash', 'Daily Temp. Checks']","['Prompt Service', 'Cash and Cards accepted', 'Delivery Only']","Chocolava Cake, Veggie Pizza, Spicy Paneer, Double Cheese Margherita, Garlic Bread, House Pizza, Paneer Tikka Pizza",Rs. 550 for two people (approx.)
faasos-pimple-nilakh,Very Good,39,['+91843352322'],['Delivery Only'],Opens tomorrow at 9am,,Wraps,"['5 - Excellent', 'Well Sanitized Kitchen', 'Rider Hand Wash', 'Daily Temp. Checks']","['Cash only', 'Delivery Only']",Rs. 550 for two people (approx.)
barometer-kothrud,Excellent,"1,580",['+919112271000'],"['Breakfast', 'Home Delivery', 'Full Bar Available', 'Live Sports Screening', 'Serves Cocktails', 'Wifi', 'All Day Breakfast', 'Brunch', 'Desserts and Bakes', 'Indoor Seating']",Opens tomorrow at 7:30am,"Shop 2, Chintamani Pride, City Pride Road, Paschimanagri, Kothrud, Pune",Casual Dining,[],"['₹179 for a pint of beer (approx.)', 'Cash and Cards accepted', 'Breakfast', 'Home Delivery', 'Full Bar Available', 'Live Sports Screening', 'Serves Cocktails', 'Wifi', 'All Day Breakfast', 'Brunch', 'Desserts and Bakes', 'Indoor Seating']","Friendly Staff, Courteous Staff, Prompt Service, Decor, Lovely Ambience, Comfortable Seating","Rs. 1,500 for two people (approx.) Without alcohol"
